[
  {
    "id": "w1-d1",
    "week": 1,
    "day": 1,
    "theme": {
      "hi": "?",
      "en": "?"
    },
    "concept": {
      "hi": "C",
      "en": "o"
    },
    "activity": {
      "hi": "??? ?? ???? ?????",
      "en": "Find a color or shape."
    },
    "mission": {
      "hi": "???? ???? ?? ??? ???? ?? ?????; ?? ????? ????? ???",
      "en": "Tell or show something you like; every try is good."
    },
    "story": {
      "title": {
        "hi": "????? ?? ???",
        "en": "A Game of Colors"
      },
      "summary": {
        "hi": "C ?? ???? ??? ?? ????, ???? ??????",
        "en": "A short, gentle story about o."
      },
      "license": "ORIGINAL"
    },
    "paperPrompt": {
      "hi": "C ?? ?? ????? ????? ?? ?????",
      "en": "Draw one picture about o on paper."
    },
    "license": "ORIGINAL"
  },
  {
    "id": "w1-d2",
    "week": 1,
    "day": 2,
    "theme": {
      "hi": "?",
      "en": "?"
    },
    "concept": {
      "hi": "??? ?? ????",
      "en": "Red and yellow"
    },
    "activity": {
      "hi": "?????? ?? ???? ?? ?????",
      "en": "Count objects at an easy pace."
    },
    "mission": {
      "hi": "???? ???? ?? ??? ???? ?? ?????; ?? ????? ????? ???",
      "en": "Tell or show something you like; every try is good."
    },
    "story": {
      "title": {
        "hi": "????? ?? ???",
        "en": "A Game of Colors"
      },
      "summary": {
        "hi": "??? ?? ???? ?? ???? ??? ?? ????, ???? ??????",
        "en": "A short, gentle story about red and yellow."
      },
      "license": "ORIGINAL"
    },
    "paperPrompt": {
      "hi": "??? ?? ???? ?? ?? ????? ????? ?? ?????",
      "en": "Draw one picture about red and yellow on paper."
    },
    "license": "ORIGINAL"
  },
  {
    "id": "w1-d3",
    "week": 1,
    "day": 3,
    "theme": {
      "hi": "?",
      "en": "?"
    },
    "concept": {
      "hi": "?? ?? ????",
      "en": "One to five"
    },
    "activity": {
      "hi": "??? ??? ???? ?????",
      "en": "Draw a shape in the air."
    },
    "mission": {
      "hi": "???? ???? ?? ??? ???? ?? ?????; ?? ????? ????? ???",
      "en": "Tell or show something you like; every try is good."
    },
    "story": {
      "title": {
        "hi": "????? ?? ???",
        "en": "A Game of Colors"
      },
      "summary": {
        "hi": "?? ?? ???? ?? ???? ??? ?? ????, ???? ??????",
        "en": "A short, gentle story about one to five."
      },
      "license": "ORIGINAL"
    },
    "paperPrompt": {
      "hi": "?? ?? ???? ?? ?? ????? ????? ?? ?????",
      "en": "Draw one picture about one to five on paper."
    },
    "license": "ORIGINAL"
  },
  {
    "id": "w1-d4",
    "week": 1,
    "day": 4,
    "theme": {
      "hi": "?",
      "en": "?"
    },
    "concept": {
      "hi": "????",
      "en": "Circle"
    },
    "activity": {
      "hi": "????? ?? ???? ?? ?????",
      "en": "Listen carefully and describe."
    },
    "mission": {
      "hi": "???? ???? ?? ??? ???? ?? ?????; ?? ????? ????? ???",
      "en": "Tell or show something you like; every try is good."
    },
    "story": {
      "title": {
        "hi": "????? ?? ???",
        "en": "A Game of Colors"
      },
      "summary": {
        "hi": "???? ?? ???? ??? ?? ????, ???? ??????",
        "en": "A short, gentle story about circle."
      },
      "license": "ORIGINAL"
    },
    "paperPrompt": {
      "hi": "???? ?? ?? ????? ????? ?? ?????",
      "en": "Draw one picture about circle on paper."
    },
    "license": "ORIGINAL"
  },
  {
    "id": "w1-d5",
    "week": 1,
    "day": 5,
    "theme": {
      "hi": "?",
      "en": "?"
    },
    "concept": {
      "hi": "???? ?? ???? ?????",
      "en": "Soft and loud sounds"
    },
    "activity": {
      "hi": "?? ?????? ?? ???? ?????",
      "en": "Tell the order of two things."
    },
    "mission": {
      "hi": "???? ???? ?? ??? ???? ?? ?????; ?? ????? ????? ???",
      "en": "Tell or show something you like; every try is good."
    },
    "story": {
      "title": {
        "hi": "????? ?? ???",
        "en": "A Game of Colors"
      },
      "summary": {
        "hi": "???? ?? ???? ????? ?? ???? ??? ?? ????, ???? ??????",
        "en": "A short, gentle story about soft and loud sounds."
      },
      "license": "ORIGINAL"
    },
    "paperPrompt": {
      "hi": "???? ?? ???? ????? ?? ?? ????? ????? ?? ?????",
      "en": "Draw one picture about soft and loud sounds on paper."
    },
    "license": "ORIGINAL"
  },
  {
    "id": "w1-d6",
    "week": 1,
    "day": 6,
    "theme": {
      "hi": "?",
      "en": "?"
    },
    "concept": {
      "hi": "???? ?? ??? ???",
      "en": "Before and after"
    },
    "activity": {
      "hi": "?? ???????? ?????? ?? ??????",
      "en": "Match two safe objects."
    },
    "mission": {
      "hi": "???? ???? ?? ??? ???? ?? ?????; ?? ????? ????? ???",
      "en": "Tell or show something you like; every try is good."
    },
    "story": {
      "title": {
        "hi": "????? ?? ???",
        "en": "A Game of Colors"
      },
      "summary": {
        "hi": "???? ?? ??? ??? ?? ???? ??? ?? ????, ???? ??????",
        "en": "A short, gentle story about before and after."
      },
      "license": "ORIGINAL"
    },
    "paperPrompt": {
      "hi": "???? ?? ??? ??? ?? ?? ????? ????? ?? ?????",
      "en": "Draw one picture about before and after on paper."
    },
    "license": "ORIGINAL",
    "recordingPrompt": {
      "hi": "???? ??????? ???? ?? ?? ???? ????? ?? ????? ??????? ????",
      "en": "An adult may record a short sound or story if they wish."
    }
  },
  {
    "id": "w1-d7",
    "week": 1,
    "day": 7,
    "theme": {
      "hi": "?",
      "en": "?"
    },
    "concept": {
      "hi": "????? ??????",
      "en": "Matching things"
    },
    "activity": {
      "hi": "???????? ??? ?? ????? ?? ??? ?????? ???? ?????",
      "en": "Notice something lovely nearby from a safe place."
    },
    "mission": {
      "hi": "???? ???? ?? ??? ???? ?? ?????; ?? ????? ????? ???",
      "en": "Tell or show something you like; every try is good."
    },
    "story": {
      "title": {
        "hi": "????? ?? ???",
        "en": "A Game of Colors"
      },
      "summary": {
        "hi": "????? ?????? ?? ???? ??? ?? ????, ???? ??????",
        "en": "A short, gentle story about matching things."
      },
      "license": "ORIGINAL"
    },
    "paperPrompt": {
      "hi": "????? ?????? ?? ?? ????? ????? ?? ?????",
      "en": "Draw one picture about matching things on paper."
    },
    "license": "ORIGINAL"
  },
  {
    "id": "w2-d1",
    "week": 2,
    "day": 1,
    "theme": {
      "hi": "?",
      "en": "?"
    },
    "concept": {
      "hi": "N",
      "en": "a"
    },
    "activity": {
      "hi": "??? ?? ???? ?????",
      "en": "Find a color or shape."
    },
    "mission": {
      "hi": "???? ???? ?? ??? ???? ?? ?????; ?? ????? ????? ???",
      "en": "Tell or show something you like; every try is good."
    },
    "story": {
      "title": {
        "hi": "??????? ?? ???",
        "en": "Nature Discoveries"
      },
      "summary": {
        "hi": "N ?? ???? ??? ?? ????, ???? ??????",
        "en": "A short, gentle story about a."
      },
      "license": "ORIGINAL"
    },
    "paperPrompt": {
      "hi": "N ?? ?? ????? ????? ?? ?????",
      "en": "Draw one picture about a on paper."
    },
    "license": "ORIGINAL"
  },
  {
    "id": "w2-d2",
    "week": 2,
    "day": 2,
    "theme": {
      "hi": "?",
      "en": "?"
    },
    "concept": {
      "hi": "?????",
      "en": "Leaves"
    },
    "activity": {
      "hi": "?????? ?? ???? ?? ?????",
      "en": "Count objects at an easy pace."
    },
    "mission": {
      "hi": "???? ???? ?? ??? ???? ?? ?????; ?? ????? ????? ???",
      "en": "Tell or show something you like; every try is good."
    },
    "story": {
      "title": {
        "hi": "??????? ?? ???",
        "en": "Nature Discoveries"
      },
      "summary": {
        "hi": "????? ?? ???? ??? ?? ????, ???? ??????",
        "en": "A short, gentle story about leaves."
      },
      "license": "ORIGINAL"
    },
    "paperPrompt": {
      "hi": "????? ?? ?? ????? ????? ?? ?????",
      "en": "Draw one picture about leaves on paper."
    },
    "license": "ORIGINAL"
  },
  {
    "id": "w2-d3",
    "week": 2,
    "day": 3,
    "theme": {
      "hi": "?",
      "en": "?"
    },
    "concept": {
      "hi": "?? ?? ??",
      "en": "Six to ten"
    },
    "activity": {
      "hi": "??? ??? ???? ?????",
      "en": "Draw a shape in the air."
    },
    "mission": {
      "hi": "???? ???? ?? ??? ???? ?? ?????; ?? ????? ????? ???",
      "en": "Tell or show something you like; every try is good."
    },
    "story": {
      "title": {
        "hi": "??????? ?? ???",
        "en": "Nature Discoveries"
      },
      "summary": {
        "hi": "?? ?? ?? ?? ???? ??? ?? ????, ???? ??????",
        "en": "A short, gentle story about six to ten."
      },
      "license": "ORIGINAL"
    },
    "paperPrompt": {
      "hi": "?? ?? ?? ?? ?? ????? ????? ?? ?????",
      "en": "Draw one picture about six to ten on paper."
    },
    "license": "ORIGINAL"
  },
  {
    "id": "w2-d4",
    "week": 2,
    "day": 4,
    "theme": {
      "hi": "?",
      "en": "?"
    },
    "concept": {
      "hi": "?????",
      "en": "Square"
    },
    "activity": {
      "hi": "????? ?? ???? ?? ?????",
      "en": "Listen carefully and describe."
    },
    "mission": {
      "hi": "???? ???? ?? ??? ???? ?? ?????; ?? ????? ????? ???",
      "en": "Tell or show something you like; every try is good."
    },
    "story": {
      "title": {
        "hi": "??????? ?? ???",
        "en": "Nature Discoveries"
      },
      "summary": {
        "hi": "????? ?? ???? ??? ?? ????, ???? ??????",
        "en": "A short, gentle story about square."
      },
      "license": "ORIGINAL"
    },
    "paperPrompt": {
      "hi": "????? ?? ?? ????? ????? ?? ?????",
      "en": "Draw one picture about square on paper."
    },